:START_ID(Document),:END_ID(Organization),:TYPE
大语言模型在大学生心理健康干预中的应用与挑战,线上会议,PUBLISHED_BY
Annotinolide C和3-吲哚氮杂螺环化合物的合成研究,兰州大学,PUBLISHED_BY
企业数字化转型与企业会计稳健性,上海外国语大学,PUBLISHED_BY
高职院校教师数字胜任力模型构建研究,天津大学,PUBLISHED_BY
纳米氧化钼颗粒的绿色合成及对小白菜产量品质的影响,华中农业大学,PUBLISHED_BY
废塑料铁基催化热解过程及碳纳米管调控机制研究,华中科技大学,PUBLISHED_BY
两株赣南脐橙根际解磷菌的分离鉴定及其解磷机制研究,江西理工大学,PUBLISHED_BY
ribC的持续进化提高黄素单核苷酸的全细胞催化合成,江南大学,PUBLISHED_BY
两类分数阶COVID-19传染病动力学模型研究,辽宁工程技术大学,PUBLISHED_BY
基于计算机视觉的学生课堂行为识别研究与应用,太原师范学院,PUBLISHED_BY
基于视觉感知的行为识别关键技术研究,北京交通大学,PUBLISHED_BY
钼基过渡金属催化剂表面重构及电催化水裂解研究,青岛科技大学,PUBLISHED_BY
数字经济赋能中国式现代化的路径研究,吉林大学,PUBLISHED_BY
多元表征理论下的高中数学教学设计研究,宁夏师范学院,PUBLISHED_BY
基于对比学习的多模态虚假新闻检测研究,北京邮电大学,PUBLISHED_BY
数字经济发展、企业融资结构与企业技术创新,广西大学,PUBLISHED_BY
基于决策树模型肿瘤患者不同静脉通路的成本-效用分析,成都医学院,PUBLISHED_BY
中青年血液系统癌症患者的症状群及对健康相关生活质量的影响,山东大学,PUBLISHED_BY
酞菁改性二氧化钛复合材料的d轨道电子调控及光催化特性研究,河南师范大学,PUBLISHED_BY
有机芳香化合物的电催化应用与合成,重庆大学,PUBLISHED_BY
基于深度学习的芯片封装基板表面缺陷检测研究,天津职业技术师范大学,PUBLISHED_BY
基于Transformer的超高清视频质量评估方法研究,广州大学,PUBLISHED_BY
随机森林模型预测分化型甲状腺癌患者甲状腺切除术后生活质量的分析研究,河北医科大学,PUBLISHED_BY
基于机器视觉的钢板表面缺陷检测研究,武汉工程大学,PUBLISHED_BY
抗纤软肝颗粒通过TLR4信号通路防治肝硬化肠源性内毒素血症的作用与机制研究,湖北中医药大学,PUBLISHED_BY
面向异构联邦学习的训练流程优化技术研究,中国科学技术大学,PUBLISHED_BY
基于深度学习的心理咨询机器人软件系统的设计与实现,中北大学,PUBLISHED_BY
93例猫急慢性肾衰的临床调查与诊疗,塔里木大学,PUBLISHED_BY
顺应论指导下科技文本英汉翻译实践报告,西安理工大学,PUBLISHED_BY
多酶级联转化苏氨酸合成L-2-氨基丁酸,江南大学,PUBLISHED_BY
基于PI3K/Akt/NF-κB通路探讨痰瘀同治方对TMAO诱导动脉粥样硬化血管炎症作用机制,中国中医科学院,PUBLISHED_BY
基于深度学习的田间作物与杂草识别,天津农学院,PUBLISHED_BY
基于多组学技术探究肉兔不同体重的分子调控机制,四川农业大学,PUBLISHED_BY
基于人工智能的内镜虚拟标尺的建立及临床应用研究,安徽医科大学,PUBLISHED_BY
光、电诱导烯烃双官能化构建含硒/硫苯并噁嗪及内酯衍生物研究,河北大学,PUBLISHED_BY
S公司生产车间数字化管理方案优化与应用研究,东华理工大学,PUBLISHED_BY
高血压人群脑卒中干预策略的卫生经济学评价研究,江西中医药大学,PUBLISHED_BY
多运动视觉里程计关键技术及应用研究,武汉大学,PUBLISHED_BY
基于机器视觉的FDM 3D打印在线检测,浙江理工大学,PUBLISHED_BY
基于深度学习的通用矿产资源预测方法研究,吉林大学,PUBLISHED_BY
英语复句的计量特征研究,浙江大学,PUBLISHED_BY
模糊语言环境下的知识表示与约简研究,大连海事大学,PUBLISHED_BY
多源数据驱动的电力设备状态预估与电网弹性提升研究,湖南大学,PUBLISHED_BY
现代养殖场中基于深度学习的影像中动物检测与多目标跟踪,北京邮电大学,PUBLISHED_BY
基于机器视觉的行人目标检测与跟踪算法研究,西安工业大学,PUBLISHED_BY
基于深度学习的果园病虫害识别研究,青岛农业大学,PUBLISHED_BY
团队多样性对科学文献创新的影响研究,武汉大学,PUBLISHED_BY
基于机器视觉技术的烟条包装检测系统研究与应用,南京信息工程大学,PUBLISHED_BY
智媒时代媒体AI虚拟主播的受众感知价值对观看意愿的影响研究,贵州民族大学,PUBLISHED_BY
基于关键链技术的Y公司医疗知识图谱项目进度管理研究,中国科学院大学(中国科学院大学工程科学学院）,PUBLISHED_BY
基于深度强化学习的航空发动机智能控制方法研究,南京航空航天大学,PUBLISHED_BY
基于成对样本的对抗学习算法研究,华中农业大学,PUBLISHED_BY
肿瘤细胞外泌体GDF-15蛋白调控癌症恶病质的机制研究,华东师范大学,PUBLISHED_BY
基于线结构光的机器人视觉系统开发与应用,中北大学,PUBLISHED_BY
中医老年养生理论研究,中国中医科学院,PUBLISHED_BY
超冷原子系统物理性质研究,中国科学技术大学,PUBLISHED_BY
基于偶联/环芳构化构建间烯基苯甲醛的研究,重庆大学,PUBLISHED_BY
亚氧化钛材料的制备及其催化性能研究,中国科学技术大学,PUBLISHED_BY
宫颈癌患者二元应对、亲密关系及创伤后成长的相关性研究,江南大学,PUBLISHED_BY
地缘政治风险与中美股市及黄金市场的关系研究,云南财经大学,PUBLISHED_BY
合肥市某镇18岁以上人群血脂防治知识知晓情况及影响因素分析,安徽医科大学,PUBLISHED_BY
两种杜鹃花的比较基因组学研究与花色分化机制初探,北京林业大学,PUBLISHED_BY
甲状腺乳头状癌淋巴转移相关基因预后模型的建立及机制探索,北京协和医学院,PUBLISHED_BY
考虑消费者质疑的绿色供应链定价及区块链采用策略研究,哈尔滨理工大学,PUBLISHED_BY
腔光力系统中振子的冷却及非经典态的制备,华中师范大学,PUBLISHED_BY
基于混合神经网络的文本情感分析研究,广西民族大学,PUBLISHED_BY
混合配体构筑的金属-有机框架及其光催化性能的研究,大连理工大学,PUBLISHED_BY
基于字节对编码的无损压缩算法,浙江大学,PUBLISHED_BY
基于BERT模型的方面级情感分析研究,西安石油大学,PUBLISHED_BY
基于态势数据驱动的作战指挥智能决策方法,中国北京,PUBLISHED_BY
电化学促进硫自由基的氧化偶联反应及炔烃双官能团化反应研究,江西师范大学,PUBLISHED_BY
基于深度学习的视觉重定位技术研究,浙江大学,PUBLISHED_BY
基于特征点的指代表达理解算法研究,广西大学,PUBLISHED_BY
基于深度学习的SAR图像舰船目标检测,中国电子科技集团公司电子科学研究院,PUBLISHED_BY
负载型单原子氧还原/析出电催化剂活性中心改性设计,燕山大学,PUBLISHED_BY
作为桥梁的“gay蜜”关系：中国青年学生MSM艾滋病自检干预实践报告,深圳大学,PUBLISHED_BY
废旧产品回收再制造供应链定价决策模型与协调机制研究,武汉科技大学,PUBLISHED_BY
基于多模态深度学习的儿童下呼吸道感染数据库构建及应用,重庆医科大学,PUBLISHED_BY
低噪声电容式MEMS麦克风研究与设计,西安电子科技大学,PUBLISHED_BY
面向森林火情监测的图像检测分割方法研究,西安理工大学,PUBLISHED_BY
高温放线菌比较基因组学及其代谢初步研究,贵州大学,PUBLISHED_BY
数字经济促进居民消费升级的影响机制与路径,内蒙古财经大学,PUBLISHED_BY
中医健康干预对中老年失眠患者的临床疗效研究,新疆医科大学,PUBLISHED_BY
基于计算机视觉的桥梁结构车致振动及裂缝识别研究,浙江大学,PUBLISHED_BY
基于深度学习的图像边缘检测算法研究,河北建筑工程学院,PUBLISHED_BY
CdIn2S4基复合物的构筑及其光催化苄胺偶联协同产H2O2性能研究,贵州大学,PUBLISHED_BY
基于多模态学习的恶性肿瘤预后预测方法,中国科学院大学(中国科学院深圳先进技术研究院),PUBLISHED_BY
新冠疫情下中国三省农村居民传染病预防行为调查研究,昆明医科大学,PUBLISHED_BY
江苏银行金融科技赋能绿色信贷影响的研究,广州大学,PUBLISHED_BY
高脂饮食诱导肠道区域免疫变化及二氢杨梅素通过肠道3型固有淋巴样细胞改善2型糖尿病的作用研究,中国人民解放军陆军军医大学,PUBLISHED_BY
线上线下延续护理在中青年乳腺癌患者术后化疗期间的应用,江南大学,PUBLISHED_BY
带有媒介的两类随机传染病模型的平稳分布和灭绝,东北师范大学,PUBLISHED_BY
量子纠缠的判定与度量,中国科学技术大学,PUBLISHED_BY
数字化转型对我国制造业企业效率的影响和机制研究,对外经济贸易大学,PUBLISHED_BY
基于代码相似性比较的二进制程序漏洞检测技术研究,国防科技大学,PUBLISHED_BY
玻璃体腔注射小分子药物京尼平对于糖尿病视网膜病变的治疗作用及机制的研究,重庆医科大学,PUBLISHED_BY
CMUT加速度传感器研究,中北大学,PUBLISHED_BY
高等工程教育中的教师教学数字胜任力研究,北京邮电大学,PUBLISHED_BY
供应链风险事件下数字技术对企业绩效的影响机制研究,山东师范大学,PUBLISHED_BY
基于引导式自注意力机制的高效感知网络在具身家居和钢铁定级场景的应用研究,广西大学,PUBLISHED_BY
武汉市小学生体质健康状况及其影响因素研究,湖北大学,PUBLISHED_BY
基于深度学习的图像描述生成算法研究,上海师范大学,PUBLISHED_BY
β-Ga2O3导模法单晶生长模拟及性能研究,山东大学,PUBLISHED_BY
高校思想政治理论课教学情感研究,电子科技大学,PUBLISHED_BY
膝骨关节炎发病机制的探索及五味子木脂素类化合物对其治疗作用及作用机制的探究,南京中医药大学,PUBLISHED_BY
养老环境下基于深度神经网络的类人认知推理模型研究,沈阳工业大学,PUBLISHED_BY
基于图像的水下动物目标识别与行为分析研究,青岛农业大学,PUBLISHED_BY
面向文本的对抗攻击与防御技术研究,广州大学,PUBLISHED_BY
智能小车数字孪生系统建模与控制,北方工业大学,PUBLISHED_BY
基于生物信息学分析DARS2基因在膀胱癌及泛癌中的表达和意义,济宁医学院,PUBLISHED_BY
熊去氧胆酸的生物催化体系构建与改造研究,天津科技大学,PUBLISHED_BY
铜配合物在可见光催化有机合成中的应用,江苏大学,PUBLISHED_BY
基于人工智能下的陕西传统灯彩产品创新设计研究,西安理工大学,PUBLISHED_BY
靶向FAP和整合素αvβ3的新型放射性药物用于肿瘤诊治的研究,北京大学医学部,PUBLISHED_BY
光热效应强化BiOBr基光催化剂降解水中四环素的机制研究,哈尔滨工业大学,PUBLISHED_BY
多元低铱氧化物电催化剂：组分协同机制与析氧催化性能研究,吉林大学,PUBLISHED_BY
个人生物识别信息的法律保护问题研究,西南政法大学,PUBLISHED_BY
甲状腺乳头状癌超声造影特征与肿瘤大小、颈部淋巴结转移的关系研究,右江民族医学院,PUBLISHED_BY
circSCAP通过调节铁死亡和hsa-miR-761/PHF20L1轴促进反复自然流产,中国广东广州,PUBLISHED_BY
A县农商银行中小企业贷款风险管理研究,广西大学,PUBLISHED_BY
公务员应用生成式人工智能的伦理问题与对策研究,北京邮电大学,PUBLISHED_BY
基于强化学习的自动驾驶汽车轨迹规划与控制方法,江苏大学,PUBLISHED_BY
基于GPS轨迹和深度学习模型的移动行为模式和语义研究,重庆大学,PUBLISHED_BY
深硅槽刻蚀应用于微机电系统中的工艺研究,南昌大学,PUBLISHED_BY
基于人工标识增强的多传感器融合定位方法研究,福建农林大学,PUBLISHED_BY
基于知识图谱的人工智能领域知识问答系统,大连理工大学,PUBLISHED_BY
基于深度强化学习的船舶避碰算法研究,哈尔滨工程大学,PUBLISHED_BY
废旧电子产品双渠道回收闭环供应链定价与服务决策研究,北京交通大学,PUBLISHED_BY
石墨相氮化碳基光催化剂的制备及其选择性氧化性能研究,南开大学,PUBLISHED_BY
催化裂化装置反应—再生等过程循环系统稳态模拟中的动态迭代方法,中国石油大学(北京),PUBLISHED_BY
苯丙氨酸对洛哌丁胺诱导便秘大鼠症状改善和肠道菌群影响的初步研究,山西医科大学,PUBLISHED_BY
基于预训练语言模型的中文短文本分类研究,江苏科技大学,PUBLISHED_BY
数字货币视域下反洗钱监管法律制度修正,江西财经大学,PUBLISHED_BY
基于视觉的羽毛球收集整理机器人设计与实现,吉林化工学院,PUBLISHED_BY
机械化学法制备ZIF负载金属纳米催化剂及其不饱和醛加氢性能研究,南昌大学,PUBLISHED_BY
整合基因组学和转录组学挖掘绵羊重要性状的候选基因,安徽农业大学,PUBLISHED_BY
粤港澳大湾区科技创新政策的量化及绩效评价,南昌大学,PUBLISHED_BY
香豆素类光敏保护基在光响应脱氧核苷单体开发中的应用,中国石油大学(华东),PUBLISHED_BY
基于多模态知识图谱的智能教学辅助平台的设计与实现,湖北师范大学,PUBLISHED_BY
信息化时代劳动精神及其培育研究,武汉大学,PUBLISHED_BY
肉鸡屠宰链沙门菌流行和耐药性调查及细菌基因组学分析,四川农业大学,PUBLISHED_BY
KINβγ调节拟南芥花粉中线粒体和油体数量的分子机制,山东农业大学,PUBLISHED_BY
苯酚降解菌Alcaligenes faecalis JF101的耐盐特性及机理研究,广西大学,PUBLISHED_BY
大数据背景下A市税务局个人所得税征管优化研究,青岛大学,PUBLISHED_BY
基于肿瘤多模态特征融合的免疫疗效预测方法研究,华东交通大学,PUBLISHED_BY
后疫情时代新型戒烟服务模式的建立与应用,中国北京,PUBLISHED_BY
时序网络的节点动态表征与学习研究,电子科技大学,PUBLISHED_BY
人工智能应用中儿童个人信息保护研究,北京外国语大学,PUBLISHED_BY
CKD1-4期合并高血压患者中医体质及相关因素分析,黑龙江中医药大学,PUBLISHED_BY
小学生早期代数思维发展研究,华东师范大学,PUBLISHED_BY
模拟微重力环境下肺炎克雷伯菌的遗传变异特征研究,贵州大学,PUBLISHED_BY
0D/2D梯形（S型）异质结材料的构筑及光催化性能研究,南昌航空大学,PUBLISHED_BY
结合YOLOv5神经网络轻量化改进的视觉SLAM算法研究,辽宁大学,PUBLISHED_BY
4-羟基苯甘氨酸（HPG）单体以及含HPG生物聚酯的生物合成研究,青岛科技大学,PUBLISHED_BY
大数据时代高校精准思想政治教育研究,湖南大学,PUBLISHED_BY
人工智能对我国产业结构升级的影响研究,江西财经大学,PUBLISHED_BY
生物炭催化热解挥发分转化中结构演化过程研究,济南大学,PUBLISHED_BY
慢性肾脏病蛋白质能量消耗的临床影响因素分析及中医证型研究,南方医科大学,PUBLISHED_BY
老年人数字权利的行政法保护研究,江西师范大学,PUBLISHED_BY
基于计算机视觉与深度学习的油茶果目标检测方法研究,西北农林科技大学,PUBLISHED_BY
人工智能如何影响国家治理,武汉大学,PUBLISHED_BY
基于数据-知识混合驱动的CFB机组建模与优化运行研究,华北电力大学(北京),PUBLISHED_BY
人工智能的意向性问题研究,山西大学,PUBLISHED_BY
海参来源具有修复功能的肽和蛋白的挖掘及活性评价,齐鲁工业大学,PUBLISHED_BY
Co/Cu氧化物的定向调控及其对废塑料回收造粒过程模拟VOCs的催化氧化机制,福建师范大学,PUBLISHED_BY
慢性缺氧心肌代谢重塑的研究,南昌大学,PUBLISHED_BY
雄激素性脱发与外周血代谢性指标相关性的研究,吉林大学,PUBLISHED_BY
分解集成框架下时间序列的混合预测方法及应用研究,兰州财经大学,PUBLISHED_BY
肿瘤微环境响应型纳米给药体系的构建及其抗肿瘤活性研究,河南大学,PUBLISHED_BY
核桃各部位体外抗氧化性、抑菌活性比较及分心木在中式香肠的防腐保鲜作用研究,成都大学,PUBLISHED_BY
量子纠缠分析,中国科学技术大学,PUBLISHED_BY
基于Transformer的图像语义分割方法研究,长春工业大学,PUBLISHED_BY
工业图像无监督异常检测与定位研究,电子科技大学,PUBLISHED_BY
烟酰胺类衍生物细胞工厂的构建与优化,江南大学,PUBLISHED_BY
移动液压机械臂控制系统设计与运动控制研究,山东大学,PUBLISHED_BY
坎离砂穴位贴敷防治乳腺癌化疗相关性恶心呕吐的临床研究,湖南中医药大学,PUBLISHED_BY
基于多尺度熵特征和集成学习的电机轴承故障诊断研究,安徽理工大学,PUBLISHED_BY
太极拳姿势评估教学平台评分模块的优化实验研究,广州体育学院,PUBLISHED_BY
大样本、多种动物基因组学数据的遗传变异挖掘与分析,华中农业大学,PUBLISHED_BY
基于机器视觉的小麦籽粒品种识别系统,河南科技学院,PUBLISHED_BY
基于双系统理论的慢性病患者多重用药风险感知与决策模型优化研究,华中科技大学,PUBLISHED_BY
周仲瑛教授从湿热瘀毒郁结复合病机辨治肝硬化应用基础研究,南京中医药大学,PUBLISHED_BY
云南省宫颈癌发病危险因素和局部晚期宫颈癌治疗效果及卫生经济学评价研究,昆明医科大学,PUBLISHED_BY
基于Transformer的多模态图像融合算法研究,电子科技大学,PUBLISHED_BY
基于非靶向代谢组学探讨不同体型犬的代谢特征及差异,赣南医科大学,PUBLISHED_BY
微波辅助催化合成植物甾醇酯的研究,江南大学,PUBLISHED_BY
基于疲劳状态下的脑网络研究进展,中国山东日照,PUBLISHED_BY
镍基氧/磷化物的可控制备及其电催化水和尿素分解研究,重庆工商大学,PUBLISHED_BY
新型吡唑磺胺及硫醚衍生物的设计、合成及生物活性评价,安徽农业大学,PUBLISHED_BY
量子纠缠度量和量子关联,华南理工大学,PUBLISHED_BY
刺糖多孢菌中与多杀菌素生物合成相关的功能基因鉴定,上海师范大学,PUBLISHED_BY
领域知识图谱半自动化构建技术研究与实现,电子科技大学,PUBLISHED_BY
中国新闻奖短视频新闻获奖作品叙事研究（2018-2021）,河南大学,PUBLISHED_BY
半夏白术天麻汤合桃红四物汤治疗原发性高血压（痰瘀互结证）的回顾性分析,广西中医药大学,PUBLISHED_BY
可解释性医疗人工智能对医护人员创新行为影响因素研究,安徽理工大学,PUBLISHED_BY
库蚊黄病毒报告病毒的构建与应用评价,军事科学院,PUBLISHED_BY
含时社交网络表征学习方法研究,武汉大学,PUBLISHED_BY
深度学习大模型时代的自然语言生成技术研究,电子科技大学,PUBLISHED_BY
基于关键词提取的评论分析系统研究,太原师范学院,PUBLISHED_BY
基于咽部微生物组学研究银翘散治疗儿童风热伤络型过敏性紫癜的机制,河南中医药大学,PUBLISHED_BY
脑科学规律在高中语文论述类文本教学中的理解与实践——以《突破高考第4题(论证分析类主观题)》公开课为例,线上会议,PUBLISHED_BY
我国AIGC行业上市公司财务风险管理研究,四川师范大学,PUBLISHED_BY
CuCo2S4基复合材料的摩擦催化降解有机污染物性能研究,南昌航空大学,PUBLISHED_BY
中国产业链安全问题研究,中共中央党校（国家行政学院）,PUBLISHED_BY
浙江省X县税务局智能化纳税服务建设研究,长春工业大学,PUBLISHED_BY
浆态床加氢裂化过程中掺炼催化油浆的影响与作用研究,中国石油大学(北京),PUBLISHED_BY
智能工程测量机器人研究,江苏海洋大学,PUBLISHED_BY
海南近岸珊瑚微生物组种间空间变化特征及对环境胁迫的响应研究,海南大学,PUBLISHED_BY
Tim-3通过NF-κB/STAT3信号通路促进乳腺癌侵袭性和化疗耐药,山东大学,PUBLISHED_BY
基于跨模态特征的关注目标定位与跟踪方法研究,中国人民公安大学,PUBLISHED_BY
基于就业结构优化的高等职业教育结构调整研究,天津大学,PUBLISHED_BY
基于β-二酮亚胺配体的主族和过渡金属有机化合物的合成、表征及催化性能研究,苏州大学,PUBLISHED_BY
基于驻极体光学频谱与光电容积相结合的呼吸及心血管疾病诊断研究,华中科技大学,PUBLISHED_BY
基于机器视觉的摄像头模组焊接缺陷检测研究,桂林电子科技大学,PUBLISHED_BY
基于深度学习的地面垃圾拾捡机器人抓取研究,沈阳工业大学,PUBLISHED_BY
红外单光子探测器的研制,中国科学技术大学,PUBLISHED_BY
基于深度学习的机械臂柔性物体操纵研究,武汉纺织大学,PUBLISHED_BY
人参皂苷Rb1缓解博来霉素诱导的小鼠肺纤维化及其机制研究,北京协和医学院,PUBLISHED_BY
肠道菌群可能通过激活炎症小体进而调控失眠障碍的发生发展:一种新的微生物组-宿主相互作用机制假设,中国四川成都,PUBLISHED_BY
基于脑科学的高中物理大单元教学设计,华中师范大学,PUBLISHED_BY
基于深度学习的轨道环境视觉感知算法研究,北京交通大学,PUBLISHED_BY
基于多准则决策的太阳能发电站选址研究,广西大学,PUBLISHED_BY
数字孪生环境下陆战智能体对抗决策研究,辽宁工程技术大学,PUBLISHED_BY
结构位移与裂缝计算机视觉识别方法,哈尔滨工业大学,PUBLISHED_BY
低共熔体系中可溶阳极电沉积制备镍铁基催化电极用于阴离子交换膜电解水,昆明理工大学,PUBLISHED_BY
面向数据隐私保护的联邦学习技术研究,齐鲁工业大学,PUBLISHED_BY
基于单光子探测的光场统计性质的研究,山西大学,PUBLISHED_BY
基于改进DeepLabV3+的柑橘分割算法研究,陕西理工大学,PUBLISHED_BY
高山松与白皮松的遗传变异格局和演化动力,北京林业大学,PUBLISHED_BY
隐私保护的去中心联邦学习研究,西安电子科技大学,PUBLISHED_BY
新闻元素在电影中的应用研究,河北科技大学,PUBLISHED_BY
基于整合临床数据的深度影像组学预测牙种植体脱落风险,重庆医科大学,PUBLISHED_BY
基于宽禁带半导体CuCrO2及ZnO材料的光电特性研究,长春理工大学,PUBLISHED_BY
基于深度学习的视频语义分割方法研究,中国科学技术大学,PUBLISHED_BY
人工智能对我国劳动收入份额的影响研究,西南大学,PUBLISHED_BY
基于影像学报告的肺结节良恶性鉴别及多原发肺癌的多组学研究,北京协和医学院,PUBLISHED_BY
数智时代档案赋能韧性城市的活化利用机制研究,湘潭大学,PUBLISHED_BY
N-乙酰神经氨酸工程菌的构建及其合成条件的优化,深圳大学,PUBLISHED_BY
基于机器视觉的机械臂路径规划方法的研究,长春工业大学,PUBLISHED_BY
基于深度学习算法的桂林市旅游网络舆情分析,桂林理工大学,PUBLISHED_BY
数字化下特高压装备质量风险管控模型及云平台研究,华北电力大学(北京),PUBLISHED_BY
延边地区慢性心力衰竭患者安宁疗护需求及影响因素分析,延边大学,PUBLISHED_BY
新冠肺炎CT图像病灶特性智能分析关键技术研究,南京航空航天大学,PUBLISHED_BY
非酒精性脂肪性肝病中医证型分布研究,南京中医药大学,PUBLISHED_BY
基于多组学联合分析山羊乳膻味形成的分子机理研究,西北农林科技大学,PUBLISHED_BY
脑研究热点数据库建设,东南大学,PUBLISHED_BY
老龄化背景下人工智能缓解劳动力短缺问题的实证研究,江西财经大学,PUBLISHED_BY
中学教师智慧教学胜任力模型构建及影响因素研究,东北师范大学,PUBLISHED_BY
中性粒细胞铁死亡引发系统性自身免疫的研究,北京协和医学院,PUBLISHED_BY
TGF-β/TGF-βRⅡ轴通过调控c-JUN激活在慢性肝损伤中的作用研究,中国江苏南京,PUBLISHED_BY
判别式视觉跟踪算法中深度特征表示与模型更新策略研究,长安大学,PUBLISHED_BY
饲粮快速/慢速发酵碳水化合物比例差异对泌乳驴乳品质、脂质代谢和直肠微生物的影响,塔里木大学,PUBLISHED_BY
动态受限单原子催化剂与CO催化氧化,郑州大学,PUBLISHED_BY
基于组合神经网络与集成学习进阶模型的城市公共建筑能耗预测研究,广西大学,PUBLISHED_BY
桥梁检测领域知识图谱问答关键技术研究,重庆交通大学,PUBLISHED_BY
迷迭香酸对急性肺损伤的抗炎抗氧化作用及其机制研究,广西大学,PUBLISHED_BY
轨道角动量光的频率变换及在量子信息中的应用,中国科学技术大学,PUBLISHED_BY
材料显微结构与电化学性能高通量数据处理技术研究,北京科技大学,PUBLISHED_BY
球磨作用下的过渡金属氧/硫化物缺陷调控及其电催化析氧过程研究,兰州大学,PUBLISHED_BY
基于窄禁带半导体碲化铋的Bi2Te3/SnO异质结的热光伏特性研究,东南大学,PUBLISHED_BY
创新驱动技术发展，走好电网数字化转型之路,中国能源报,PUBLISHED_BY
新型生物标志物EPRS在肝细胞癌的研究,南方医科大学,PUBLISHED_BY
基于微生物组学解析性别对贵州本地羊粪便微生物区系及其发酵产物的影响,贵州大学,PUBLISHED_BY
乳腺癌患者失志综合征影响因素的病例对照研究,华北理工大学,PUBLISHED_BY
废聚乙烯塑料催化热解制碳纳米管的研究,中国科学技术大学,PUBLISHED_BY
好氧堆肥过程中石油污染物降解及氮素转化机制研究,武汉大学,PUBLISHED_BY
