:START_ID(Document),:END_ID(Organization),:TYPE
基于基因组的蚶类血红蛋白的起源与演化研究,中国云南昆明,PUBLISHED_BY
量子纠缠的直接测量研究,安徽大学,PUBLISHED_BY
花生红衣原花青素对溃疡性结肠炎干预效果与机制研究,华中农业大学,PUBLISHED_BY
D电力信通公司发展战略研究,内蒙古财经大学,PUBLISHED_BY
蚕蛹蛋白肽的制备及其抗炎活性研究,广西大学,PUBLISHED_BY
密炼机混炼过程模拟及可视化研究,青岛科技大学,PUBLISHED_BY
聚合物半导体激子特性调控及其在光催化氧分子活化中的应用,中国科学技术大学,PUBLISHED_BY
基于土壤上方暴露大鼠尸体的微生物组数据推测死亡时间,贵州医科大学,PUBLISHED_BY
乳腺癌术后患者复发恐惧及心理社会适应现状调查研究,吉林大学,PUBLISHED_BY
食管癌放疗期患者症状群及前哨症状的研究,河北医科大学,PUBLISHED_BY
绿色供应链优化决策与回收策略研究,河南农业大学,PUBLISHED_BY
基于关键酶理性改造及底盘细胞适应性进化构建Gluconobacter oxydans高效制备非天然α-氨基酸,江南大学,PUBLISHED_BY
Dawson构型钨磷杂多酸催化纤维素水解反应过程的研究,华南农业大学,PUBLISHED_BY
副干酪乳酪杆菌甲基化转移酶突变体比较三维基因组学分析,内蒙古农业大学,PUBLISHED_BY
肠源性信号分子调控阿尔茨海默病神经炎症及黄连解毒汤干预机制研究,中国中医科学院,PUBLISHED_BY
官僚政治模型下明朝在壬辰战争中的战和决策研究,吉林大学,PUBLISHED_BY
智慧警务背景下居民安全感影响因素与提升对策研究,中国人民公安大学,PUBLISHED_BY
基于AJCC-TRG分级胃癌新辅助化疗不同应答肿瘤微生物组学改变及其临床意义：单中心回顾性研究,青岛大学,PUBLISHED_BY
灌浆期温光胁迫对双季籼稻光合特性、籽粒灌浆及碳氮代谢相关酶的影响,江西农业大学,PUBLISHED_BY
基于图像的产品感性特征语义智能解析模型与方法研究,四川大学,PUBLISHED_BY
UCE系统发育基因组学方法的优化及其在斑蛛族三属系统学研究中的应用（跳蛛科）,河北大学,PUBLISHED_BY
应用于细胞及病毒示踪的多尺度分子成像技术研究,郑州大学,PUBLISHED_BY
自然环境下脐橙果实快速识别与定位研究,江西农业大学,PUBLISHED_BY
基于腈的氧化C-CN键断裂实现的酰胺化和绿色氰基化新反应的发展,江南大学,PUBLISHED_BY
TJ光电集团发展战略研究,广西大学,PUBLISHED_BY
基于视觉感知的工厂化养殖智能投喂管理决策方法研究,重庆工商大学,PUBLISHED_BY
应用比较基因组学技术研究乳酸肠球菌食品分离株的安全性,内蒙古农业大学,PUBLISHED_BY
几种多功能纳米复合材料的设计合成及其在肿瘤协同治疗中的应用探索,中国科学技术大学,PUBLISHED_BY
生产性服务业智能化对我国制造业效率的影响研究,东北师范大学,PUBLISHED_BY
基于社会支持理论下的阿尔茨海默症照护服务体系研究,大连医科大学,PUBLISHED_BY
赶黄草花和叶中黄酮的分离纯化、组分分析及生物活性研究,华南理工大学,PUBLISHED_BY
“主动健康”理念下老年大学健身瑜伽课程教学内容的优化研究,沈阳体育学院,PUBLISHED_BY
以证素-方元为基础的冠心病数据挖掘与网络药理学研究,中国中医科学院,PUBLISHED_BY
基于条纹图案二维傅里叶变换的三维成像仿真研究,哈尔滨理工大学,PUBLISHED_BY
人工智能生成内容（AIGC）著作权保护研究,山西财经大学,PUBLISHED_BY
导模法柱状β-Ga2O3单晶生长、缺陷及性能研究,山东大学,PUBLISHED_BY
农作物种质资源知识图谱构建及应用研究,中国农业科学院,PUBLISHED_BY
基于深度学习的车辆及行人检测算法研究,南昌大学,PUBLISHED_BY
油菜DH诱导性状近等基因系的构建及P3-2全基因组测序分析,四川农业大学,PUBLISHED_BY
基于网络药理学和分子对接的逍遥散干预阿尔茨海默病的分子机制研究,湖北中医药大学,PUBLISHED_BY
基于计算病理学的癌症预后分析研究,南方医科大学,PUBLISHED_BY
智慧法院建设背景下执行案款管理的探究,山西大学,PUBLISHED_BY
肠道菌群参与糖尿病相关性粥样动脉硬化发生发展的机制研究,山东大学,PUBLISHED_BY
基于文本挖掘的协作学习会话分析与应用研究,江南大学,PUBLISHED_BY
淋巴瘤患者自我管理水平发展轨迹及影响因素的纵向研究,电子科技大学,PUBLISHED_BY
基于改进BPNN模型的钦州湾海表温盐遥感反演研究,广西大学,PUBLISHED_BY
单细胞转录组解析食管癌发生多阶段过程中上皮及基质微环境动态变化,北京协和医学院,PUBLISHED_BY
面向计算机视觉的生成对抗网络研究与应用,电子科技大学,PUBLISHED_BY
贝叶斯网状Meta分析评价前列地尔联合其它药物对慢性肾衰竭的疗效,中国医科大学,PUBLISHED_BY
TBM隧道围岩动态感知及掘进参数辅助决策方法研究,北京交通大学,PUBLISHED_BY
宏基因组学第二代测序技术在老年重症肺炎诊治中的应用,大连医科大学,PUBLISHED_BY
加热模拟葡萄汁对酵母菌产呋喃酮的影响,塔里木大学,PUBLISHED_BY
癌症住院患者跌倒风险预测模型的构建,浙江中医药大学,PUBLISHED_BY
基于模糊实物期权的科创板芯片企业价值评估研究,山东工商学院,PUBLISHED_BY
培元宁神膏治疗老年慢性失眠的临床研究及机制探讨,广州中医药大学,PUBLISHED_BY
生成式人工智能模型训练的法律属性与版权法规制,浙江工商大学,PUBLISHED_BY
工作中使用人工智能对组织公民行为的影响研究,哈尔滨工业大学,PUBLISHED_BY
航空发动机精锻叶片自动化生产线关键技术研究,西北工业大学,PUBLISHED_BY
基于多模态MRI探讨2型糖尿病周围神经病变脑改变及分类,中南大学,PUBLISHED_BY
基于多模态深度融合的跨领域虚假新闻检测研究,中国人民公安大学,PUBLISHED_BY
大学生体质健康干预效果的Meta分析研究,中国天津,PUBLISHED_BY
基于单细胞测序探究干燥综合征唾液腺微环境特征和上皮细胞-免疫细胞的交互关系,中国人民解放军海军军医大学,PUBLISHED_BY
人尿源干细胞胞外囊泡抗衰老的作用与机制研究,中南大学,PUBLISHED_BY
胆汁酸受体法尼酯衍生物X受体拮抗剂的设计与合成,中国科学院大学(中国科学院上海药物研究所),PUBLISHED_BY
慢性乙型肝炎不确定期患者采用不同抗病毒治疗方案的疗效及安全性分析,大理大学,PUBLISHED_BY
基于知识图谱的个性化新闻推荐模型研究,西安理工大学,PUBLISHED_BY
基于数据驱动的焊接接头疲劳寿命预测研究,大连交通大学,PUBLISHED_BY
数据驱动的地铁施工安全风险评估与应对研究,中国矿业大学,PUBLISHED_BY
生物基化学品关键催化过程的分子模拟及机理研究,北京化工大学,PUBLISHED_BY
亚厘米实性肺结节的人工智能辅助CT影像诊断研究,北京协和医学院,PUBLISHED_BY
基于政策文本和基金项目的研究前沿识别研究,中国科学院大学(中国科学院文献情报中心),PUBLISHED_BY
高原驻训官兵咳嗽的流行病学调查,中国人民解放军空军军医大学,PUBLISHED_BY
基于交通视频的多目标检测和跟踪算法研究,西南科技大学,PUBLISHED_BY
非金属Lewis酸碱对催化“一锅法”合成嵌段共聚物,华中科技大学,PUBLISHED_BY
基于机器视觉的轴承圆柱滚子表面缺陷检测系统研究,哈尔滨理工大学,PUBLISHED_BY
慢性心力衰竭患者疾病进展恐惧影响因素及其短期再入院事件的纵向研究,扬州大学,PUBLISHED_BY
戊型肝炎病毒慢性感染免疫抑制兔模型的建立、致病性和防治研究,北京大学医学部,PUBLISHED_BY
高粱多组学数据库的整合构建,中国农业科学院,PUBLISHED_BY
国家高新区、产城融合与高技术企业数字化转型关系研究,哈尔滨工程大学,PUBLISHED_BY
基于机器视觉的管道全位置焊接熔池检测技术研究,湖北文理学院,PUBLISHED_BY
框架理论视角下科技文本英汉翻译实践报告,西安理工大学,PUBLISHED_BY
压电/等离激元协同增强二硫化钼基性能研究,山东师范大学,PUBLISHED_BY
植物乳杆菌胞外囊泡抑制炎症反应促进DPSCs成牙本质向分化,中国福建厦门,PUBLISHED_BY
基于SNN-MLP的时序数据识别的抗干扰能力研究,河北科技大学,PUBLISHED_BY
维奈和达贝尔内翻译模式下《英国基因组：医疗的未来》（节选）英汉翻译实践报告,西南科技大学,PUBLISHED_BY
基于cfDNA全基因组测序技术的肝癌早诊早筛模型研究,中国人民解放军海军军医大学,PUBLISHED_BY
高段小学生数智阅读现状调查与对策研究,南昌大学,PUBLISHED_BY
基于Transformer模型的机器翻译研究,重庆邮电大学,PUBLISHED_BY
基于深度学习的杨梅成熟度检测仪的研发,浙江科技学院,PUBLISHED_BY
等离激元调控的光/光热CO2催化反应及机理研究,山东大学,PUBLISHED_BY
数智化时代Y食品公司发展战略优化研究,青岛大学,PUBLISHED_BY
云南原始森林土壤宏基因组中β-内酰胺酶编码基因的鉴定及其潜在风险研究,扬州大学,PUBLISHED_BY
"利用碱参与的炔酮双官能团化反应合成1,3,5-三烯及1,4-二硫(硒)环己二烯衍生物的研究",华东师范大学,PUBLISHED_BY
面向公共突发事件领域的因果事理图谱构建研究,西安工业大学,PUBLISHED_BY
面向图像重构的语义通信系统设计与实现,电子科技大学,PUBLISHED_BY
人工智能算法法律规制构建研究,江西财经大学,PUBLISHED_BY
基于机器视觉的输电线路巡检研究,东莞理工学院,PUBLISHED_BY
中医智能辅助诊疗系统多决策辨证模型的构建与应用,山东中医药大学,PUBLISHED_BY
基于YOLOv5的安全帽检测算法研究,武汉纺织大学,PUBLISHED_BY
智能制造影响碳排放的效果与机制研究,浙江财经大学,PUBLISHED_BY
基于Transformer的方面级情感分析方法研究,重庆工商大学,PUBLISHED_BY
利用放射组学和基因组学特征，建立肺癌气腔播散的预测模型,南京医科大学,PUBLISHED_BY
点击化学合成生物基聚合物及其性质研究,贵州大学,PUBLISHED_BY
高氮三唑铱/钌配合物的合成及催化甲酸析氢性能研究,中南大学,PUBLISHED_BY
磺酸酯和芳基砜的合成方法研究,东华理工大学,PUBLISHED_BY
基于网络分析的卵巢癌患者化疗期间症状群的研究,兰州大学,PUBLISHED_BY
机械安全风险预警关键技术研究,南京理工大学,PUBLISHED_BY
自然果园环境下基于深度学习的目标果实生长监测研究,山东师范大学,PUBLISHED_BY
中国跨境支付企业发展影响因素研究,北部湾大学,PUBLISHED_BY
γ-氨基丁酸(GABA)补充在老年人慢病防治中的展望：从生长激素、睡眠和压力角度出发,中国天津,PUBLISHED_BY
结直肠癌幸存者饮食依从性干预方案构建研究：干预映射,吉林大学,PUBLISHED_BY
肺结节患者恐惧疾病进展的影响因素及其发展轨迹研究,扬州大学,PUBLISHED_BY
基于“以证统病，异病同治”的导引治疗脾虚湿困型代谢性疾病研究,中国北京,PUBLISHED_BY
基于知识图谱的司法领域自动问答系统关键技术研究,北华航天工业学院,PUBLISHED_BY
精神疾病与神经胶质瘤风险的关系:来自孟德尔随机化分析的证据,中国福建厦门,PUBLISHED_BY
基于人工智能的EGFR-TKI治疗肺腺癌患者的预后分析和获得性耐药亚型预测,广西医科大学,PUBLISHED_BY
基于深度学习的健康组织影像基因组学分析,深圳大学,PUBLISHED_BY
动态各向异性相对渗透率曲线测试与表征方法研究,中国地质大学(北京),PUBLISHED_BY
虎皮楠生物碱Calyciphylline N的合成探索及活性评价,西北农林科技大学,PUBLISHED_BY
基于领域知识图谱的问答技术研究,内蒙古大学,PUBLISHED_BY
基于知识图谱与关键词注意力机制的中文医疗问答匹配方法,南京邮电大学,PUBLISHED_BY
代谢工程改造酿酒酵母从头合成δ-生育三烯酚,江南大学,PUBLISHED_BY
面向无标注长文本和低资源场景的抽取式文本摘要,华东师范大学,PUBLISHED_BY
知识转移视角下社会工作参与多学科心理健康干预的研究,山东大学,PUBLISHED_BY
基于济南商埠文化遗产的数字化保护研究,山东工艺美术学院,PUBLISHED_BY
智能制造对企业绿色全要素生产率的影响研究,西安建筑科技大学,PUBLISHED_BY
基于气象灾害数据驱动的应急资源动态调配方法研究,南京信息工程大学,PUBLISHED_BY
广西大学学术期刊集群化发展调研报告,广西大学,PUBLISHED_BY
高动态低轨卫星光网络路由选择关键技术研究,北京邮电大学,PUBLISHED_BY
基于蛋白质组学的肝癌及癌旁组织分子特征研究,中国科学院大学(中国科学院上海药物研究所),PUBLISHED_BY
聚合物基纳米复合材料用于放疗增敏及辐射防护,吉林大学,PUBLISHED_BY
基于深度学习的医疗报告生成关键技术研究,四川大学,PUBLISHED_BY
胶原多肽钙螯合物的制备及其微胶囊化与稳定性研究,四川农业大学,PUBLISHED_BY
大肠杆菌生产莽草酸的多重代谢工程策略,天津科技大学,PUBLISHED_BY
一种多组学数据联合分析方法的构建,昆明理工大学,PUBLISHED_BY
新型铋基催化材料的制备及其对水中污染物的光催化机理研究,华南理工大学,PUBLISHED_BY
基于DCE-MRI和RNA-Seq数据的乳腺癌影像基因组学研究,东南大学,PUBLISHED_BY
人工智能对全球价值链地位的影响效应及作用机制研究,浙江大学,PUBLISHED_BY
基于MEMS谐振器的6G滤波器设计,中国科学技术大学,PUBLISHED_BY
人工智能时代高校思想政治教育话语权提升的路径研究,北京邮电大学,PUBLISHED_BY
基于电动汽车充电负荷时空分布预测的充电站布局优化及有序充放电策略研究,西安理工大学,PUBLISHED_BY
基于深度学习的道路安全头盔佩戴检测算法研究,中国矿业大学,PUBLISHED_BY
中性粒细胞胞外诱捕网（NETs）对于抗磷脂综合征妊娠并发症的致病机制研究,北京协和医学院,PUBLISHED_BY
基于双模态特征融合的鱼类视频目标分割研究与应用,大连海洋大学,PUBLISHED_BY
UV/Fenton氧化去除VOCs过程中催化-传质协同作用及其机制研究,北京科技大学,PUBLISHED_BY
基于知识蒸馏的深度神经网络压缩技术研究,河北科技大学,PUBLISHED_BY
气溶胶喷墨打印纳米铜墨水制备及其应用研究,哈尔滨工业大学,PUBLISHED_BY
颈动脉不稳定性斑块中医证型与SLCO1B1&ApoE基因分型相关性研究,广州中医药大学,PUBLISHED_BY
基于证素辨证原理的糖脂代谢指标的中医辨证意义研究,广州中医药大学,PUBLISHED_BY
改革开放以来中国检察发展史研究（1978-2022）,扬州大学,PUBLISHED_BY
基于收益共享-退货成本共担契约的社区团购供应链协调,北京交通大学,PUBLISHED_BY
铜催化烯基硼自由基加成合成烷基硼化合物的研究,合肥工业大学,PUBLISHED_BY
基因组学初探豺濒危遗传机制,中国湖北宜昌,PUBLISHED_BY
基于深度学习的分子属性预测方法研究,兰州大学,PUBLISHED_BY
氯链素衍生物的设计合成及抗菌活性研究,南京农业大学,PUBLISHED_BY
基于图学习的药物-靶标相互作用预测研究,青岛理工大学,PUBLISHED_BY
电纺超薄双相光敏水凝胶膜免缝合快速修复大血管损伤的研究,贵州医科大学,PUBLISHED_BY
蒙古烟煤水蒸气气化过程中电石渣催化效应的失活研究,内蒙古工业大学,PUBLISHED_BY
基于蒙古语学术语体语料库的句法计量研究,内蒙古大学,PUBLISHED_BY
基于结构方程模型的我国老年人抑郁现状及影响因素分析,大连医科大学,PUBLISHED_BY
黄连温胆汤抗溃疡性结肠炎及结肠癌的药效和作用机制研究,广州中医药大学,PUBLISHED_BY
基于熵估计能量模型的具身智能视觉导航,大连海事大学,PUBLISHED_BY
钛基氧化物对二元醇的选择性转化,华北电力大学(北京),PUBLISHED_BY
妇科癌症患者及其配偶二元应对和生活质量的关系：亲密关系的中介作用,中国医科大学,PUBLISHED_BY
基于工业机器人的铸件打磨关键技术研究,石家庄铁道大学,PUBLISHED_BY
两亲性聚苯丙氨酸-赖氨酸的化学酶法合成及其应用,江南大学,PUBLISHED_BY
运动与慢病防治的研究进展,中国山东日照,PUBLISHED_BY
考虑本体模态的机器人铣削加工稳定性预测与结构增强抑振研究,华中科技大学,PUBLISHED_BY
重十四族元素自由基的合成、表征及性质研究,苏州大学,PUBLISHED_BY
基于知识蒸馏的港口环境下人员危险行为检测研究,燕山大学,PUBLISHED_BY
肺炎克雷伯菌可移动遗传元件的研究,军事科学院,PUBLISHED_BY
电化学合成3-碘吲哚和2，3-二氨基吲哚衍生物的反应研究,南京林业大学,PUBLISHED_BY
单环刺螠肠道核心微生物组对环丙沙星的响应研究,烟台大学,PUBLISHED_BY
MOFs衍生金属氧化物催化C-H健氧化反应研究,济南大学,PUBLISHED_BY
金属—半导体复合纳米结构设计及其光驱动甲烷转化应用研究,中国科学技术大学,PUBLISHED_BY
金融科技与城市经济高质量发展：结构特征与机制识别,武汉大学,PUBLISHED_BY
基于单目摄像头的室内老人跌倒识别研究,南京邮电大学,PUBLISHED_BY
副蛔虫和猪蛔虫染色体组型数目特征研究,东北林业大学,PUBLISHED_BY
人工智能计算机图形对动画本体认知产生的影响探究,山东工艺美术学院,PUBLISHED_BY
智慧社会治理的伦理风险及其规避策略研究,中共广东省委党校,PUBLISHED_BY
整合微生物组、代谢组和转录组的逍遥散与帕罗西汀联用抗抑郁作用研究,山西大学,PUBLISHED_BY
基于机器视觉的橙幼果识别与病虫害检测方法,华中农业大学,PUBLISHED_BY
金融错配对企业全要素生产率的影响研究,齐鲁工业大学,PUBLISHED_BY
基于钆的高灵敏MRI探针在重大疾病诊疗中的应用研究,北京化工大学,PUBLISHED_BY
隔日禁食改善2型糖尿病小鼠血管内皮功能的机制研究,北京中医药大学,PUBLISHED_BY
算法组织决策对消费者感知企业道德的影响研究,华中科技大学,PUBLISHED_BY
铁皮石斛多糖D1N1的制备及对肠道微生态的调控作用研究,长春中医药大学,PUBLISHED_BY
结直肠癌造口患者尊严受损水平及其影响因素的研究,昆明医科大学,PUBLISHED_BY
联邦学习的隐私协议机制设计,贵州大学,PUBLISHED_BY
神经网络结构搜索关键技术的研究及其应用,厦门大学,PUBLISHED_BY
多孔晶态材料及其衍生物的制备和电催化CO2还原性能研究,南京师范大学,PUBLISHED_BY
不同载畜率下荒漠草原优势植物短花针茅氮素吸收及同化过程与土壤微生物作用,内蒙古农业大学,PUBLISHED_BY
基于代谢组学的缺血性心脑血管病气虚血瘀证的血小板相关机制研究,中国中医科学院,PUBLISHED_BY
基于情感感知与数据增强的虚假新闻检测研究,东南大学,PUBLISHED_BY
棉花多组学数据分析平台的构建,华中农业大学,PUBLISHED_BY
基于对比学习的用户文本聚类模型研究,华东师范大学,PUBLISHED_BY
有机荧光探针的设计合成及其在Hg2+检测中的应用研究,中南林业科技大学,PUBLISHED_BY
空气污染传染病模型的动力学行为,宁夏大学,PUBLISHED_BY
急诊科碳青霉烯类药物使用情况分析暨基于人工智能的碳青霉烯类药物合理使用临床决策支持系统的构建,四川大学,PUBLISHED_BY
网毯式成藏体系断裂输导油气作用及规律研究,中国石油大学(北京),PUBLISHED_BY
田黄方对肾脏纤维化的保护作用及机制研究,广东药科大学,PUBLISHED_BY
基于群体基因组学揭示大螟栖息地扩张和适应性进化的分子机制,中国农业科学院,PUBLISHED_BY
基于深度学习的计算药物发现研究,中国矿业大学,PUBLISHED_BY
大庆长垣南部茂2区块扶余油层致密砂岩储层质量定量评价,东北石油大学,PUBLISHED_BY
基于视觉认知的可视化导航交互设计研究,东南大学,PUBLISHED_BY
具不同子类的传染病模型的传播动力学,兰州大学,PUBLISHED_BY
智能问答系统语义理解与答案生成方法研究,重庆邮电大学,PUBLISHED_BY
基于SEIR模型和社会网络的新冠疫情传播演化研究,重庆工商大学,PUBLISHED_BY
拟口蘑属的系统发育位置、属下分类和物种多样性（蘑菇目）,中国贵州贵阳,PUBLISHED_BY
保鲜努力水平信息不对称下的生鲜供应链三方协调研究,青岛理工大学,PUBLISHED_BY
基于紧致张量化模型的网络压缩与训练加速研究,哈尔滨工业大学,PUBLISHED_BY
溅射用超高纯铜靶材DS轧制工艺研究,燕山大学,PUBLISHED_BY
自动驾驶汽车致害法律责任认定研究,广西大学,PUBLISHED_BY
联合InSAR和深度学习的城市道路网形变监测与预测方法研究,安徽理工大学,PUBLISHED_BY
HDAC4在下颌髁突生长发育中的作用,中国福建厦门,PUBLISHED_BY
亚胺卟啉共价有机框架的制备及性能研究,中北大学,PUBLISHED_BY
人工智能服务失败责任归因与补救策略研究,江苏大学,PUBLISHED_BY
基于健康信念的媒介形态干预效果研究,深圳大学,PUBLISHED_BY
小麦优质、耐逆等农艺性状解析与分子改良研究,中国湖南长沙,PUBLISHED_BY
安全联邦学习与隐私推理计算中的关键技术研究,西安电子科技大学,PUBLISHED_BY
基于改进Faster-RCNN行人检测算法的研究,哈尔滨理工大学,PUBLISHED_BY
天然联苄衍生物的设计、制备及生物活性研究,山东大学,PUBLISHED_BY
"钯催化2-呋喃甲酸“溴化-羰化羧化”串联反应合成2,5-呋喃二甲酸",华东师范大学,PUBLISHED_BY
脑卒中患者疾病复发恐惧量表的编制与初步应用,承德医学院,PUBLISHED_BY
潮汕游神主题的拼贴动画创作策略,广州美术学院,PUBLISHED_BY
铁线莲属（毛茛科）大叶铁线莲组的系统发生基因组学和历史生物地理学研究,北京林业大学,PUBLISHED_BY
运动营养学中的饮食策略对运动表现和恢复的影响,中国江西南昌,PUBLISHED_BY
蝶啶衍生物作为抗肿瘤药物的设计、合成以及作用机制研究,青岛科技大学,PUBLISHED_BY
漂浮型g-C3N4基复合光催化剂的制备及其对富营养化水体藻类抑制研究,长安大学,PUBLISHED_BY
吸烟与非小细胞肺癌免疫微环境及免疫治疗预后的相关性研究,南方医科大学,PUBLISHED_BY
基于机器视觉与深度学习的高通量种子识别与分割方法研究,浙江大学,PUBLISHED_BY
DNA聚合酶POLG（D260A）突变猪模型构建及线粒体DNA突变谱分析,五邑大学,PUBLISHED_BY
基于转录组数据的低级别胶质瘤放射敏感性预后模型的构建与研究,安徽理工大学,PUBLISHED_BY
水平页岩气井复杂缝网建模技术及在川南地区的应用,成都理工大学,PUBLISHED_BY
我国绿色产业发展评价与对策研究,河北经贸大学,PUBLISHED_BY
添加有机物料对土壤关键生物学特性和烤烟生长的影响,河南农业大学,PUBLISHED_BY
基于卷积神经网络的工件识别技术研究,哈尔滨商业大学,PUBLISHED_BY
人工智能在急性缺血性脑卒中早期诊断及预后预测中的应用研究,华中科技大学,PUBLISHED_BY
代谢工程改造谷氨酸棒杆菌发酵生产D-丙氨酸,天津科技大学,PUBLISHED_BY
旧金山果实乳杆菌菌株多样性与酵母菌共培养方式研究,山西大学,PUBLISHED_BY
基于循环一致性的视频运动目标高效建模研究,浙江大学,PUBLISHED_BY
芳香性三角形钯配合物的合成及其在具有C-I选择性的偶联反应中的应用,聊城大学,PUBLISHED_BY
基于深度学习的ENSO建模及其预测和可预报性研究,中国科学院大学(中国科学院海洋研究所),PUBLISHED_BY
考虑参考价格效应的双渠道零售商定价和库存联合优化研究,燕山大学,PUBLISHED_BY
乌鲁木齐市心脑血管疾病流行现状及时空分析研究,新疆医科大学,PUBLISHED_BY
机关、企事业单位工间操健康干预方案,中国广东广州,PUBLISHED_BY
催化生化耦合转化CO2制乙酸的研究,北京化工大学,PUBLISHED_BY
大型舱体构件原位加工多机器人协同任务规划技术研究,南京航空航天大学,PUBLISHED_BY
产业关键共性技术创新生态系统运行机制研究,哈尔滨工程大学,PUBLISHED_BY
振动压路机土壤压实质量智能检测方法研究,长安大学,PUBLISHED_BY
图像和视频超分辨率的研究,电子科技大学,PUBLISHED_BY
AI生成内容著作权法律地位之证否及其法律保护研究,厦门大学,PUBLISHED_BY
SEM内粘滑驱动纳米操作机器人路径跟踪控制研究,哈尔滨工业大学,PUBLISHED_BY
ChatGPT生成内容著作权侵权风险与应对策略研究,广西大学,PUBLISHED_BY
基于双目视觉的多机同步定位及地图构建技术研究,燕山大学,PUBLISHED_BY
基于知识图谱的问答系统的研究与医学场景应用,北京邮电大学,PUBLISHED_BY
基于机器视觉的激光焊接质量在线监测算法研究,东华大学,PUBLISHED_BY
基于项目化学习的小学机器人教学设计研究,四川师范大学,PUBLISHED_BY
沥青路面智能化养护管理关键技术研究,东南大学,PUBLISHED_BY
高产甾体生物碱的藜芦悬浮细胞培养体系的建立,西北农林科技大学,PUBLISHED_BY
基于计算机视觉算法的武汉湖泊公园景观意象特征及感知偏好研究,华中农业大学,PUBLISHED_BY
