:START_ID(Document),:END_ID(Organization),:TYPE
云南越桔T2T基因组测序及GST基因家族全基因组分析,贵州师范大学,PUBLISHED_BY
胃癌术后患者化疗间歇期症状群的干预效果研究,山西医科大学,PUBLISHED_BY
乳腺癌患者及配偶疾病感知、正念与癌症复发恐惧的关系：家庭回避癌症沟通的中介作用,山东大学,PUBLISHED_BY
基于仿生忆阻神经网络的情绪整合学习电路设计,郑州轻工业大学,PUBLISHED_BY
全媒体场域中我国主流意识形态传播研究,贵州师范大学,PUBLISHED_BY
基于自然语言处理技术的建筑工程安全事故风险研究,苏州科技大学,PUBLISHED_BY
钙钛矿氧化物的阳离子调控及其电催化合成氨性能研究,江南大学,PUBLISHED_BY
基于车牌识别数据的城市车辆出行轨迹提取和路径选择行为研究,西华大学,PUBLISHED_BY
骨诱导Ca、P系陶瓷材料中类骨磷灰石层的形成、表征和体外动态研究模型的初步建立,四川大学,PUBLISHED_BY
垂体神经内分泌肿瘤多组学研究,河南师范大学,PUBLISHED_BY
聚（4-羟基丁酸酯）熔融纺丝性能及改性PBAT全降解材料的制备,青岛科技大学,PUBLISHED_BY
老年肺癌化疗患者心理一致感现状及影响因素研究,河北医科大学,PUBLISHED_BY
基于铁掺杂氮化碳复合材料活化过一硫酸盐降解四环素的研究：效能、理论计算及降解机制,浙江工商大学,PUBLISHED_BY
利用自旋整流对磁性材料动态性能的快速表征,兰州大学,PUBLISHED_BY
人工智能对高校思想政治教育影响研究,青海师范大学,PUBLISHED_BY
网络空间青年道德定力研究,中国矿业大学,PUBLISHED_BY
过渡金属硫化物在微观尺度下的电化学析氢应用研究,湖南大学,PUBLISHED_BY
基于Bax-BH3多肽的纳米药物递送体系研究,吉林大学,PUBLISHED_BY
“积极老龄化”视角下老旧社区适老化更新路径研究——以重庆市渝北区双龙湖街道为例,中国湖北武汉,PUBLISHED_BY
基于宽禁带半导体ZnGa2O4薄膜的忆阻器及物理瞬态研究,重庆大学,PUBLISHED_BY
基于情感词典和深度学习的微博文本情感分析,扬州大学,PUBLISHED_BY
基于多传感器融合的仿人轮腿机器人定位与建图研究,哈尔滨工业大学,PUBLISHED_BY
基于YOLOv7的课堂异常行为检测算法研究与应用,西安建筑科技大学,PUBLISHED_BY
智能音箱用户体验问卷编制及其研究,北京建筑大学,PUBLISHED_BY
面向文本数据的事件因果图构建关键技术研究,战略支援部队信息工程大学,PUBLISHED_BY
含铁压电-FENTON纳米体系的构建及其压电催化性能研究,华中农业大学,PUBLISHED_BY
人工智能技术在上皮性卵巢肿瘤术前影像诊断中的应用价值研究,北京协和医学院,PUBLISHED_BY
白腹鼠属的基因组分化与种间基因流,河北大学,PUBLISHED_BY
椅子辅助运动对绝经后女性身体机能影响的系统综述,中国北京,PUBLISHED_BY
基于高阶连续介质力学理论的功能梯度输流微管振动特性研究,西安理工大学,PUBLISHED_BY
"咪唑并[1',2':1,6]吡啶并[3,4-b]吲哚衍生物的设计、合成及生物活性研究",石河子大学,PUBLISHED_BY
氧化还原反应控制的位点专一性酶促糖苷化策略研究,山东大学,PUBLISHED_BY
探索肝癌风险人群危险分层和筛查方案制定肝癌分层筛查策略的研究,吉林大学,PUBLISHED_BY
赤峰市喀喇沁旗番茄农药残留分析及膳食暴露风险评估,内蒙古农业大学,PUBLISHED_BY
云南牟定腐乳微生物多样性及风味物质形成机理研究,云南农业大学,PUBLISHED_BY
甜菊糖对变异链球菌和白色念珠菌混合生物膜作用和功能的研究,中国人民解放军空军军医大学,PUBLISHED_BY
金属氧化物光热催化芳香烃与芳香醇的选择性氧化及其机理研究,淮北师范大学,PUBLISHED_BY
数字贸易对全球价值链分工的影响研究,中共中央党校（国家行政学院）,PUBLISHED_BY
萝卜硫素对PM2.5诱导的HBE细胞损伤及小鼠肺损伤的保护作用及其机制研究,江南大学,PUBLISHED_BY
基于高密度MEMS线圈的柔性触觉传感器研究,中北大学,PUBLISHED_BY
CT及MRI影像组学在喉癌诊断中的应用,吉林大学,PUBLISHED_BY
宽禁带半导体功率器件关态应力退化机理及寿命建模研究,西安电子科技大学,PUBLISHED_BY
数字化水平对制造业企业创新绩效的影响研究,青岛科技大学,PUBLISHED_BY
基于“证据推理与模型认知”素养的晶体结构与性质教学研究,洛阳师范学院,PUBLISHED_BY
特征视角下的深度视觉模型对抗攻击技术研究,西安电子科技大学,PUBLISHED_BY
基于深度学习的文本情感分析技术研究,电子科技大学,PUBLISHED_BY
基于数字足迹的旅游机会识别与旅游机会时空图谱构建研究,重庆理工大学,PUBLISHED_BY
基于计算机视觉与数据驱动的结构裂缝检测与损伤评估,清华大学,PUBLISHED_BY
基于影像基因组学的肺癌亚型分类与预后研究,南京信息工程大学,PUBLISHED_BY
基于表型机器人的设施环境作物自动检测方法研究,西北农林科技大学,PUBLISHED_BY
回收渠道竞争下电子产品回收供应链成员的竞合策略研究,广州大学,PUBLISHED_BY
轴灰孢属（Podaxis）的多样性和适应性进化,中国福建福州,PUBLISHED_BY
家养和野生动物的干热环境适应与保护研究,昆明理工大学,PUBLISHED_BY
麦角硫因的分析与制备纯化研究,大连海洋大学,PUBLISHED_BY
萨提亚家庭治疗模式下临终关怀实务研究,湖北师范大学,PUBLISHED_BY
人脑与深度卷积神经网络模型在面孔感知过程中的相似与不相似性表征,华东师范大学,PUBLISHED_BY
基于POI数据和Doc2Vec模型的城市功能区识别研究,中国测绘科学研究院,PUBLISHED_BY
基于实物期权的燃煤电厂CCUS投资决策模型及策略研究,东北电力大学,PUBLISHED_BY
若干含氢键供体有机物催化环氧化物与CO2环加成反应机理的理论研究,湖北大学,PUBLISHED_BY
金融科技驱动下A公司保险业务创新研究,江西财经大学,PUBLISHED_BY
一株异养硝化—好氧反硝化菌的筛选及其脱氮特性研究,华中科技大学,PUBLISHED_BY
多组学数据研究基因ALPL在乳腺癌中的作用以及其临床意义,吉林大学,PUBLISHED_BY
MEBT/MEBO对慢性难愈合创面中Collagen Ⅰ和Collagen Ⅲ表达水平影响的研究,右江民族医学院,PUBLISHED_BY
基于计算机视觉和深度学习的疲劳驾驶检测算法研究,齐鲁工业大学,PUBLISHED_BY
温州市建设工程项目的电子招投标政府监管问题研究,长春工业大学,PUBLISHED_BY
基于多信息融合的地面机器人环境感知技术研究,长春理工大学,PUBLISHED_BY
热带假丝酵母生产萜类天然产物的系统代谢工程,江南大学,PUBLISHED_BY
基于深度学习的微博谣言识别系统的设计与实现,中北大学,PUBLISHED_BY
基于文本理解的场景文本视觉问答技术研究,北京科技大学,PUBLISHED_BY
基于Transformer和CNN的图像分割算法研究,北方工业大学,PUBLISHED_BY
柴郁地仙方对多囊卵巢综合征并发抑郁模型大鼠微生物组的调节作用,厦门大学,PUBLISHED_BY
颈项导引操对慢性颈痛人群颈部疼痛、颈椎活动度以及生活质量的影响,内蒙古师范大学,PUBLISHED_BY
基于时空与类别图融合网络的城市犯罪预测模型研究,南京财经大学,PUBLISHED_BY
数字身份功能蠕变的哲学探析,贵州大学,PUBLISHED_BY
基于深度学习的茶叶嫩芽及其采摘点识别,安徽农业大学,PUBLISHED_BY
基于深度学习文本情感分类研究,杭州电子科技大学,PUBLISHED_BY
基于深度学习的智能CFD模拟研究,西安石油大学,PUBLISHED_BY
基于最优目标检测模型的冠心病痰瘀互结证裂纹舌特征研究,辽宁中医药大学,PUBLISHED_BY
量子光学系统的纠缠及其应用,清华大学,PUBLISHED_BY
基于新课改高中数学核心素养的现状调查及教学启示,贵州师范大学,PUBLISHED_BY
人工智能技术在C银行的应用水平评价及提升策略研究,安徽理工大学,PUBLISHED_BY
基于多任务学习的多模态情感、情绪和讽刺联合分析,郑州轻工业大学,PUBLISHED_BY
空间驱避剂的有效成分筛选及驱蚊效果评价研究,赣南医科大学,PUBLISHED_BY
Q银行厅堂智能化服务客户满意度提升研究,西北农林科技大学,PUBLISHED_BY
德保矮马、宁强矮马和关中马粪便微生物组及其耐药基因特征研究,新疆农业大学,PUBLISHED_BY
智慧养老模式下老年人信息保护研究,湖南工业大学,PUBLISHED_BY
基于叶绿体基因组学和转录组学对蜘蛛抱蛋属系统发育的研究,广西民族大学,PUBLISHED_BY
头颈部肿瘤患者症状群的影响因素及其对生活质量的影响,中南大学,PUBLISHED_BY
基于深度图神经网络的文本分类研究,吉林大学,PUBLISHED_BY
生成式人工智能训练合理使用研究,中国政法大学,PUBLISHED_BY
含铋半导体异质结构的制备及其在光催化领域的应用,电子科技大学,PUBLISHED_BY
基于预训练模型的新冠领域知识图谱构建,电子科技大学,PUBLISHED_BY
基于MediaPipe框架的人体动作识别模型在Y Balance Test中的应用研究,成都体育学院,PUBLISHED_BY
面向多功能贴片机的机器视觉定位关键技术研究,浙江大学,PUBLISHED_BY
番茄产吲哚-3-乙酸（IAA）细菌菌群及其主要的IAA生物合成途径分析,福建师范大学,PUBLISHED_BY
语言模型的知识增强算法研究,华东师范大学,PUBLISHED_BY
生物催化生产熊去氧胆酸及其关键酶分子改造研究,江南大学,PUBLISHED_BY
基于深度学习的图像特征提取及其应用,吉林大学,PUBLISHED_BY
紫花苜蓿窄叶突变体narrow leaf分离鉴定及苜蓿属热激转录因子基因家族分析,中国农业科学院,PUBLISHED_BY
可再生能源发电侧储能技术投资决策研究,太原理工大学,PUBLISHED_BY
多孔铜基氧化物复合材料的制备及其光催化性能研究,河北工业大学,PUBLISHED_BY
葡萄科羽叶蛇葡萄属系统发育基因组学研究,吉首大学,PUBLISHED_BY
基于MRI的人工智能对急性脑卒中再灌注损伤及预后预测的研究,南京医科大学,PUBLISHED_BY
番茄采摘机械手的场景感知及试验研究,黑龙江八一农垦大学,PUBLISHED_BY
水杨酰色胺氨基甲酸酯类衍生物的设计、合成及抗AD生物活性研究,兰州大学,PUBLISHED_BY
低铱钙钛矿水氧化催化剂微结构调控与性能研究,吉林大学,PUBLISHED_BY
A软件公司客户关系管理优化策略研究,中央民族大学,PUBLISHED_BY
区域分布式能源系统参与电力交易辅助决策模型研究,华北电力大学(北京),PUBLISHED_BY
从电极、电化学反应器到工艺：电氧化制备癸二酸二甲酯和电还原制备N-乙酰-L-半胱氨酸,吉林大学,PUBLISHED_BY
一维氧化锌基纳米材料的合成及其压电-光催化性能研究,苏州大学,PUBLISHED_BY
地层参数稀疏表征约束的地震信号高分辨率反演方法研究,电子科技大学,PUBLISHED_BY
纠缠光子的制备和应用,中国科学技术大学,PUBLISHED_BY
基于深度强化学习的自主船舶智能避碰决策关键技术研究,大连海事大学,PUBLISHED_BY
山楂叶螨引诱物质的合成与应用研究,山东农业大学,PUBLISHED_BY
中国制造业产业链现代化水平提升研究,四川大学,PUBLISHED_BY
自动驾驶场景下摄像头和毫米波雷达融合的3D目标检测,中国科学技术大学,PUBLISHED_BY
产蛋白酶菌株的ARTP诱变及其降解蛋白质代谢通路分析,辽宁师范大学,PUBLISHED_BY
基于脑科学的小学数学分数教学设计与实践,湖州师范学院,PUBLISHED_BY
新中国初期四川省传染病疫情防控及历史经验研究,成都理工大学,PUBLISHED_BY
基于嵌入式人工智能的人体姿态识别研究与实现,宁夏大学,PUBLISHED_BY
多动态障碍物环境下室内移动机器人定位感知与路径导航方法研究,哈尔滨工业大学,PUBLISHED_BY
锥栗冠绵蚧基因组特征及其系统进化地位研究,安徽师范大学,PUBLISHED_BY
过渡金属催化剂组成/结构调控及电化学合成含氮分子研究,中国科学技术大学,PUBLISHED_BY
基于改进神经辐射场的三维重建技术研究,北方工业大学,PUBLISHED_BY
众加利数字化转型对其绩效的影响研究,广西财经学院,PUBLISHED_BY
基于响应面法和人工智能代理模型的SGTR敏感性分析,华北电力大学(北京),PUBLISHED_BY
基于机器视觉的道路行人检测与跟踪方法研究,长春工业大学,PUBLISHED_BY
诺丽果酵素对健康小鼠的保健功能及LPS诱导的慢性疲劳综合征的防治作用与机制探究,吉林大学,PUBLISHED_BY
人工智能技术辅助无创肝纤维化分级和高风险食管胃静脉曲张诊断的研究,吉林大学,PUBLISHED_BY
中国北方湿地候鸟携带大肠埃希菌传播规律研究,长春工业大学,PUBLISHED_BY
结直肠癌穴位敏化现象和规律的横断面观察研究,成都中医药大学,PUBLISHED_BY
李赛美治疗糖尿病经验的多模型机器学习研究,广州中医药大学,PUBLISHED_BY
基于深度学习的视觉SLAM系统研究及应用,江南大学,PUBLISHED_BY
银行金融科技对商业银行全要素生产率的影响研究,贵州大学,PUBLISHED_BY
乙醛酸和乙醇酸的电化学合成研究,青岛科技大学,PUBLISHED_BY
基于无人机高光谱遥感及人工智能的荒漠化草原地物分类研究,内蒙古农业大学,PUBLISHED_BY
恩诺沙星对鸡粪厌氧消化性能的影响及其微生物学机制,西北农林科技大学,PUBLISHED_BY
初中数学教学中归纳推理能力培养现状及对策研究,信阳师范学院,PUBLISHED_BY
大脑与认知的神经哲学研究,山西大学,PUBLISHED_BY
基于机器视觉的老人异常行为智能检测系统,山东大学,PUBLISHED_BY
适用于中子探测的大厚度氮化硼材料的制备及其性能研究,吉林大学,PUBLISHED_BY
合成气直接法制烯烃铁基催化剂的研究,中国石油大学(北京),PUBLISHED_BY
广州市流感流行趋势及流感相关超额死亡率的估计研究,南方医科大学,PUBLISHED_BY
突发公共事件下社交媒体用户虚假信息应对行为影响因素研究,郑州航空工业管理学院,PUBLISHED_BY
西藏贝氏耳孔蜈蚣防御素多肽OBD4致痒的分子机制研究,中南民族大学,PUBLISHED_BY
基于深度学习跨时域多模态正畸根骨重建融合系统的建立,中国人民解放军空军军医大学,PUBLISHED_BY
基于Transformer和CNN的医学图像分割方法研究,长春工业大学,PUBLISHED_BY
MOFs基复合光催化剂的制备及CO2还原的研究,华北理工大学,PUBLISHED_BY
数字经济发展对劳动力就业的影响研究,吉林大学,PUBLISHED_BY
基于胸部CT图像建立肺炎深度学习分类预测模型,中国人民解放军陆军军医大学,PUBLISHED_BY
芳基重氮盐参与的自由基型砜基形成反应研究,江西师范大学,PUBLISHED_BY
利用核磁共振量子计算实验实现量子模拟,中国科学技术大学,PUBLISHED_BY
基于加密算法的安全模块的设计与验证,广东工业大学,PUBLISHED_BY
新白叶藤碱衍生物通过PI3K/AKT/mTOR信号通路抑制胃癌细胞增殖的机制研究,兰州大学,PUBLISHED_BY
基于大语言模型的个性化试题生成与精准评测研究,湖北大学,PUBLISHED_BY
基于可注射凝胶材料的肿瘤术后疫苗用于结直肠癌免疫治疗研究,吉林大学,PUBLISHED_BY
钯表面选择性催化还原NO过程中二甲胺生成路径的第一性原理研究,北京化工大学,PUBLISHED_BY
光催化酰胺自由基对杂环芳香烯烃的加成反应研究,兰州交通大学,PUBLISHED_BY
基于基因组学的膜翅目基部支系系统发育研究,江西师范大学,PUBLISHED_BY
硅基板负载二茂铁亚胺钯/钴自组装催化薄膜制备及催化Suzuki偶联反应,郑州大学,PUBLISHED_BY
miR-27b-3p在非酒精性脂肪性肝病中的作用和机制研究,吉林大学,PUBLISHED_BY
YQ农村商业银行基层网点智能化转型研究,山西大学,PUBLISHED_BY
数字化背景下邮储银行财务风险分析及控制研究,福建农林大学,PUBLISHED_BY
基于检索和知识图谱结合的开放域中文问答系统设计与实现,重庆大学,PUBLISHED_BY
影响中老年人肺功能的相关因素及基层医务人员呼吸疾病管理能力调查研究,南京医科大学,PUBLISHED_BY
基于用户生成内容的公众评论意见挖掘研究,南京邮电大学,PUBLISHED_BY
拟穴青蟹三条抗菌肽相关基因的筛选鉴定与表达特性和免疫功能研究,厦门大学,PUBLISHED_BY
酶-光-膜人工光合系统,天津大学,PUBLISHED_BY
裸伞属物种产毒性状及其基因组学研究,甘肃农业大学,PUBLISHED_BY
园艺疗法对大学生心境状态的影响研究,贵州师范大学,PUBLISHED_BY
三氧化钨基三维电极的构筑及析氢催化性能调控,北京科技大学,PUBLISHED_BY
非宽禁带半导体材料GaSe的深紫外探测应用,合肥工业大学,PUBLISHED_BY
基于数据画像的城市健康促进模型研究：来自沈阳市的证据,中国辽宁沈阳,PUBLISHED_BY
镍铁基氢氧化物的电化学合成及其析氧电催化行为研究,中国地质大学,PUBLISHED_BY
小学数学“图形与几何”大单元教学实践策略研究,宁夏大学,PUBLISHED_BY
基于强判别性特征感知与掩膜激活的实例分割算法研究,河南大学,PUBLISHED_BY
电化学合成苯并氮杂卓与喹唑啉酮类氮杂环化合物的研究,哈尔滨工业大学,PUBLISHED_BY
黄金鲈雌性偏性大小二型性及性别相关基因cyp19a1和dmrt1的功能分析,南昌大学,PUBLISHED_BY
非晶态共价有机框架材料固定化酶的制备及性能强化,天津大学,PUBLISHED_BY
油藏动态系统演化过程的描述与表征,大庆石油学院,PUBLISHED_BY
用于食源性致病菌快速检测的微流控生物传感器研究,兰州大学,PUBLISHED_BY
基于机器视觉的刀具测量系统软件开发,西安理工大学,PUBLISHED_BY
利用微生物组及转录组测序分析贵妃鸡产蛋性能的调控机制,山东农业大学,PUBLISHED_BY
藜麦蛋白的超声辅助提取及其水解物对肥胖的改善作用研究,西北农林科技大学,PUBLISHED_BY
MIL-53（Fe）金属有机框架的改性及其用于去除水中四环素性能研究,武汉科技大学,PUBLISHED_BY
海南岛南渡江抗生素抗性基因分布特征及溯源分析,南阳师范学院,PUBLISHED_BY
G市主要慢性病流行现状与危险因素控制效果模拟研究,广州中医药大学,PUBLISHED_BY
基于微生物组学与靶向代谢组学研究肠道微生物-胆汁酸轴在肝纤维化中的作用,兰州大学,PUBLISHED_BY
基于深度自适应动态网络的图文目标分割方法研究,江南大学,PUBLISHED_BY
基于计算机视觉与深度学习的裂缝检测算法研究,湖南大学,PUBLISHED_BY
数字基础设施对我国服务业发展的影响研究,山西财经大学,PUBLISHED_BY
"香豆素和α,β-不饱和酯的电化学卤化反应研究",兰州交通大学,PUBLISHED_BY
高分子STING激动剂的设计及其用于肿瘤免疫治疗研究,中国科学技术大学,PUBLISHED_BY
体教融合背景下四川省青少年体质健康管理模式创新研究,成都体育学院,PUBLISHED_BY
色氨酸代谢物抑制铁死亡促进肿瘤生长机制研究,山东大学,PUBLISHED_BY
厨余垃圾生物处理机尾水生化处理工艺优化,华东师范大学,PUBLISHED_BY
裂缝性非均质边水气藏压力动态表征方法及应用,西南石油大学,PUBLISHED_BY
高校辅导员思想政治教育话语力提升研究,西南大学,PUBLISHED_BY
面向大语言模型的参数高效微调方法的对比研究,广东外语外贸大学,PUBLISHED_BY
基于深度神经网络的道路缺陷识别,南京邮电大学,PUBLISHED_BY
藻蓝蛋白免疫肽的酶解制备、结构鉴定及功效评价,齐鲁工业大学,PUBLISHED_BY
恶性肿瘤患者疾病不确定感与信息需求、应对方式相关性研究,大理大学,PUBLISHED_BY
基于时空图卷积网络的海表温度预测研究,南京信息工程大学,PUBLISHED_BY
生成式人工智能对个人信息保护的挑战和应对,北京外国语大学,PUBLISHED_BY
结直肠癌中CCK2R功能及其靶向重组毒素构建与可应用性研究,吉林大学,PUBLISHED_BY
抽取式自解释合理化深度学习模型训练方法研究,华中科技大学,PUBLISHED_BY
ELS公司SD数据库高校市场营销策略优化研究,广西大学,PUBLISHED_BY
X公司人工智能化生产情景下的员工绩效管理研究,华北电力大学(北京),PUBLISHED_BY
基于BERT、GCN和GAT深度集成学习的文本分类算法研究,中央民族大学,PUBLISHED_BY
基于格林模式的湖南省高校民族预科学生体质健康干预研究,吉首大学,PUBLISHED_BY
基于关键词约束的文本生成方法研究,北京邮电大学,PUBLISHED_BY
氮杂环修饰锌及钒/钼氧簇催化反应研究,聊城大学,PUBLISHED_BY
基于宏基因组学探索糖耐量异常人群肠道菌群特征研究,西安医学院,PUBLISHED_BY
金融科技对商业银行信贷结构的影响,山西财经大学,PUBLISHED_BY
考虑保鲜和促销的生鲜电商供应链运作协调策略研究,哈尔滨商业大学,PUBLISHED_BY
基于互联网知识抽取的汽车故障事理图谱构建方法,广东技术师范大学,PUBLISHED_BY
诊疗规范知识可计算化模式研究,吉林大学,PUBLISHED_BY
生物活性MOFs结构调控与抗菌性能分析及其应用,中国科学技术大学,PUBLISHED_BY
“大思政课”格局下铸牢大学生中华民族共同体意识研究,山东建筑大学,PUBLISHED_BY
数字化时代中小学教师学习方式研究,江西师范大学,PUBLISHED_BY
新零售背景下TH百货营销策略优化研究,大连海事大学,PUBLISHED_BY
基于8导联心电图的人工智能技术筛查成人房间隔缺损的研究,华中科技大学,PUBLISHED_BY
二维双金属化合物的制备及能源小分子电催化转化研究,华中科技大学,PUBLISHED_BY
基于机器视觉和改进YOLOv5s的鲫鱼病害轻量级无损检测模型研究,浙江科技大学,PUBLISHED_BY
嗜麦芽寡养单胞菌的生物学特性及发酵无花果叶的研究,烟台大学,PUBLISHED_BY
叶酸联合抗高血压药物对H型高血压患者疗效的Meta分析,大理大学,PUBLISHED_BY
基于航拍视角的早期森林火灾识别研究,南京林业大学,PUBLISHED_BY
空芯反谐振光纤智能化设计研究,北京交通大学,PUBLISHED_BY
苏州市金庭镇2型糖尿病周围神经病变患病情况调查及干预研究,苏州大学,PUBLISHED_BY
基于知识图谱的饮食健康知识问答系统,南昌大学,PUBLISHED_BY
基于生成对抗网络的文本到图像合成算法研究,中国科学技术大学,PUBLISHED_BY
体医融合背景下太极桩功在产后康复的机遇、挑战与展望,中国广东广州,PUBLISHED_BY
乳腺癌化疗患者支持性照顾需求现状及影响因素的混合性研究,天津中医药大学,PUBLISHED_BY
基于脑科学的高中化学创造性思维机制研究与条件创设,哈尔滨师范大学,PUBLISHED_BY
大数据下商业银行对小微企业信贷决策模型构建研究,重庆工商大学,PUBLISHED_BY
球磨法制备钯基单原子催化剂对挥发性有机化合物脱除应用,华北电力大学(北京),PUBLISHED_BY
医院空气介质中病原微生物和耐药基因的监测和分析,扬州大学,PUBLISHED_BY
具有媒体影响和治疗函数的传染病模型研究,兰州交通大学,PUBLISHED_BY
慢性肾衰竭CKD3-5期非透析患者合并肺部感染的相关因素及中医证型研究,广州中医药大学,PUBLISHED_BY
奶牛分娩过程中回仰头姿态的自动识别及头部运动特征研究,内蒙古农业大学,PUBLISHED_BY
基本再生数新方法和传染病模型动力学分析,武汉科技大学,PUBLISHED_BY
媒介技术视角下知识传播的变异及危机研究,江西师范大学,PUBLISHED_BY
微生物组半胱氨酸分子靶标知识库与知识图谱的建立,大连理工大学,PUBLISHED_BY
鸡源性粪肠球菌的分离及益生特性研究,江西农业大学,PUBLISHED_BY
人工智能产品质量标准的法律完善,吉林财经大学,PUBLISHED_BY
单原子吸附的铁电In2Se3单层NRR及CO2RR催化性能研究,天津理工大学,PUBLISHED_BY
智能合同成立规则研究,重庆大学,PUBLISHED_BY
深度学习在中文命名实体识别算法中的应用,南京邮电大学,PUBLISHED_BY
脑库：哲学反思和伦理问题,华中科技大学,PUBLISHED_BY
基于元胞自动机方法的时空异质性传染病模型研究,吉林大学,PUBLISHED_BY
考虑Allee效应和媒体效应的传染病模型的动力学分析,西北民族大学,PUBLISHED_BY
基于SuFEx点击化学合成的聚合物有机凝胶及其应用研究,苏州大学,PUBLISHED_BY
鼠李糖乳杆菌CLK101的基因组特征及饲喂其对南丹瑶鸡的影响,昆明理工大学,PUBLISHED_BY
中国全科医学住院医师置信职业行为评价框架的构建与初步应用,中国医科大学,PUBLISHED_BY
马克思资本权力思想研究,江西师范大学,PUBLISHED_BY
RNA甲基化修饰通过调控PD-L1表达介导乳腺癌免疫逃逸的机制研究,中国人民解放军陆军军医大学,PUBLISHED_BY
p-n同质结Cu2O微粒的制备及对抗生素降解性能研究,西安理工大学,PUBLISHED_BY
人工智能生成物著作权研究,江西财经大学,PUBLISHED_BY
基于同步辐射动态表征技术的石墨烯原位生长研究,华中科技大学,PUBLISHED_BY
中青年淋巴瘤患者重返工作准备度提升方案构建及应用,郑州大学,PUBLISHED_BY
可控连接的寻求：媒介化视角下用户与虚拟人的关系研究,西南政法大学,PUBLISHED_BY
体表慢性难愈性创面住院患者的回顾性分析,西安医学院,PUBLISHED_BY
